{
  "schemaVersion": 1,
  "slug": "equipment-simulator-phase4c-release-shadow-readers",
  "classification": "Strict",
  "status": "implementation_allowed",
  "goal": "Add release-scoped read-only candidate projections and a bounded internal old/new shadow comparison for the sealed Phase 4B Gear and Community Releases without changing public readers or creating an active Manifest pointer.",
  "userValue": "The project can prove that one immutable release combination reproduces current trusted browse, Resolve and Profile behavior before any public cutover is possible.",
  "nonGoals": [
    "No public gear browse, Resolver Authority Context, Profile or frontend reader cutover",
    "No Season Manifest database row or active retail pointer creation, promotion or rollback",
    "No release, staging, sync-state or public payload write",
    "No scheduled release refresh service or timer",
    "No public baseline, recommendation, DPS comparison, optimizer or BiS behavior",
    "No Phase 5 SimC job or Worker",
    "No Phase 6 Catalyst retained-secondary-stat activation",
    "No dependency installation or unapproved local download"
  ],
  "currentTruth": {
    "sources": [
      "docs/project-state.json",
      "docs/roadmap.md",
      "docs/harness.md",
      "docs/plans/2026-07-11-equipment-simulator-phase4-release-train-plan.md",
      "artifacts/releases/2026-07-11-equipment-simulator-phase4b-pg-registry-legacy-import/evidence.json",
      "server/gear_release.py",
      "server/gear_release_store.py",
      "server/pg_gear_authority_loader.py",
      "server/postgres_cache_store.py",
      "server/pg_gear_read_model_selectors.py",
      "server/gear_runtime.py",
      "docs/backend-owner-map.json",
      "docs/project-owner-map.json"
    ],
    "activeMilestone": "equipment_simulator_phase4",
    "featureIteration": "allowed_under_harness",
    "inactiveGearReleaseId": "gear-release:sha256:342e3918b685ca0145514485d115fb74079be660d85ea8b835760c4bc61350f6",
    "inactiveCommunityReleaseId": "community-release:sha256:923ccd05f09fbe32b1827e45d7e9be163545fb187d49efcde730dbb0216682ed",
    "activeManifestPointerRows": 0
  },
  "impactMap": {
    "mustChange": [
      "release SQL remains owned by gear_release_store.py and gains read-only release-scoped projections",
      "candidate Authority Context rows are constrained to one exact Gear Release ID",
      "candidate Community rows must be validatedAgainst the same Gear Release ID",
      "one bounded internal shadow orchestration compares transitional and release-scoped readers",
      "Authority cache identity includes candidate Manifest revision and exact Gear Release ID",
      "focused missing, tampered and mixed-release fail-closed tests plus 40-spec candidate shadow evidence"
    ],
    "mustNotChange": [
      "current compatibility-pg-live-v1 public/read/Resolver path",
      "public observed-only and baseline-empty semantics",
      "zero active Manifest pointer and zero persisted candidate Manifest rows",
      "current mutable staging tables and sync writers",
      "active gear workbench and legacy endpoint compatibility",
      "deploy async-sync default and existing timer ownership",
      "Phase 6 Catalyst fail-closed state"
    ],
    "evidenceRequired": [
      "every candidate content query uses the same Gear or Community Release ID",
      "Community Release binding to the exact Gear Release is checked before projection",
      "missing registry/content rows, hash mismatch and mixed IDs return Authority unavailable without staging fallback",
      "no-pointer transitional requests remain byte/semantic compatible and do not enter the candidate reader",
      "40-spec old/new winner, Intent, legality, provenance, baseline and browse identity comparison",
      "candidate Resolve and representative canonical Profile Dependency Vector comparison",
      "cold/warm statement count, p95, cache size and bounded query-plan evidence",
      "backend/full verification, local CR, exact-head CI, candidate deployment, zero pointer/public change and rollback evidence"
    ]
  },
  "ownership": {
    "factOwner": "server/gear_release_store.py consuming pure server/gear_release.py",
    "consumers": [
      "server/pg_gear_authority_loader.py candidate projection",
      "server/postgres_cache_store.py internal shadow orchestration",
      "server/pg_gear_read_model_selectors.py candidate browse projection",
      "server/gear_runtime.py candidate Resolve/Profile shadow"
    ]
  },
  "engineeringHealth": {
    "status": "planned_read_only_release_projection",
    "reason": "Slice 4C extends the single release SQL owner and adds explicit read-only adapters. It may run old/new readers internally but cannot conditionally splice release predicates across existing staging SQL or activate a public reader."
  },
  "acceptanceEvidence": [
    "focused release-store, loader, read-model, runtime and shadow tests",
    "node --test tests/project-harness.test.js tests/backend-owner-map.test.js tests/project-owner-map.test.js tests/project-state.test.js",
    "node scripts/verify-project.js --profile backend --release artifacts/releases/2026-07-11-equipment-simulator-phase4c-release-shadow-readers --base origin/main",
    "node scripts/verify-project.js --profile full --release artifacts/releases/2026-07-11-equipment-simulator-phase4c-release-shadow-readers --base origin/main",
    "node scripts/project-harness.js --check --requirement-file artifacts/releases/2026-07-11-equipment-simulator-phase4c-release-shadow-readers/requirement.json --evidence-file artifacts/releases/2026-07-11-equipment-simulator-phase4c-release-shadow-readers/evidence.json --base origin/main",
    "Python compile, SQL/write-path inspection and git diff --check",
    "candidate 40-spec shadow, missing/mixed-release failures, zero Manifest/Pointer/public change, health/timer/log and rollback proof"
  ],
  "releaseTrigger": "pg_read_model",
  "rollback": [
    "code_rollback"
  ],
  "decisionLog": [
    {
      "date": "2026-07-11",
      "decision": "Keep all immutable release SQL in gear_release_store.py; candidate adapters consume repository projections instead of adding release SQL to existing hotspot stores."
    },
    {
      "date": "2026-07-11",
      "decision": "Use the sealed inactive Gear/Community pair as an explicit candidate binding; do not persist a Manifest or Pointer during shadow-reader implementation."
    },
    {
      "date": "2026-07-11",
      "decision": "Run release-scoped projections only through an internal shadow path. Public routes continue transitional reads until a separate Phase 4D atomic cutover."
    },
    {
      "date": "2026-07-11",
      "decision": "Treat the Phase 4B one-time import resource result as historical operator evidence, not as the performance budget for candidate readers or future scheduled refresh."
    }
  ]
}
