{
  "schemaVersion": 1,
  "slug": "equipment-simulator-phase4a-release-contracts",
  "classification": "Strict",
  "status": "implementation_allowed",
  "goal": "Establish the pure immutable release, Active Season Manifest, community election, shadow comparison and promotion policy contracts required before PostgreSQL release storage or runtime cutover.",
  "userValue": "Gear and community data can be validated as one coherent current-season release before it becomes public, preventing mixed revisions, illegal winners and silent fallback.",
  "nonGoals": [
    "No database migration, release write or active pointer in Slice 4A",
    "No browse, Resolver, Profile or frontend runtime cutover",
    "No scheduled refresh service or timer",
    "No public baseline, recommendation, DPS comparison or BiS behavior",
    "No Phase 5 SimC job or Worker",
    "No Phase 6 Catalyst retained-secondary-stat activation",
    "No dependency installation or unapproved local download"
  ],
  "currentTruth": {
    "sources": [
      "docs/project-state.json",
      "docs/roadmap.md",
      "docs/harness.md",
      "docs/plans/2026-07-10-equipment-simulator-capability-architecture-design.md",
      "docs/plans/2026-07-11-equipment-simulator-phase4-release-train-plan.md",
      "artifacts/releases/2026-07-11-equipment-simulator-phase3c-workbench-cutover/evidence.json",
      "docs/backend-owner-map.json",
      "docs/project-owner-map.json"
    ],
    "activeMilestone": "equipment_simulator_phase4",
    "featureIteration": "allowed_under_harness"
  },
  "impactMap": {
    "mustChange": [
      "one pure release domain with canonical hash-addressed Gear and Community Release contracts",
      "formal Active Season Manifest validation and release-binding rules",
      "per-spec observed candidate election with winner, standby and rejected roles",
      "40-spec shadow diff and risk-classified promotion decisions",
      "focused domain tests plus owner map, runbook, roadmap and Strict evidence"
    ],
    "mustNotChange": [
      "active PostgreSQL staging tables and runtime readers",
      "canonical Resolver and Evidence Ledger ownership",
      "active gear workbench behavior and legacy endpoint compatibility",
      "public observed-only and baseline-empty semantics",
      "PostgreSQL-only runtime and deploy async-sync default",
      "Phase 6 Catalyst fail-closed state"
    ],
    "evidenceRequired": [
      "TDD proof for canonical release IDs, immutability and manifest bindings",
      "illegal, stale, source-invalid and mixed-release election rejection",
      "deterministic winner/standby behavior and no public baseline leakage",
      "shadow diff and promotion/rollback decision coverage",
      "backend/full verification, local CR, exact-head CI and dormant candidate runtime parity"
    ]
  },
  "ownership": {
    "factOwner": "server/gear_release.py over the existing pure gear_resolver.py",
    "consumers": [
      "future Phase 4B PostgreSQL release repository",
      "future Phase 4C shadow readers",
      "future Phase 4D active manifest cutover",
      "future Phase 4E scheduled refresh"
    ]
  },
  "engineeringHealth": {
    "status": "planned_pure_domain_boundary",
    "reason": "Slice 4A adds one dependency-free policy boundary before any schema or runtime integration and reuses the canonical Resolver instead of duplicating legality facts."
  },
  "acceptanceEvidence": [
    "python3 -m unittest tests.gear_release_test",
    "python3 -m unittest tests.gear_resolver_test tests.gear_contracts_test tests.gear_evidence_ledger_test",
    "node --test tests/project-state.test.js tests/project-owner-map.test.js tests/backend-owner-map.test.js",
    "node scripts/verify-project.js --profile backend --release artifacts/releases/2026-07-11-equipment-simulator-phase4a-release-contracts --base origin/main",
    "node scripts/verify-project.js --profile full --release artifacts/releases/2026-07-11-equipment-simulator-phase4a-release-contracts --base origin/main",
    "node scripts/project-harness.js --check --requirement-file artifacts/releases/2026-07-11-equipment-simulator-phase4a-release-contracts/requirement.json --evidence-file artifacts/releases/2026-07-11-equipment-simulator-phase4a-release-contracts/evidence.json --base origin/main",
    "Python compile, purity/static boundary review and git diff --check",
    "candidate runtime parity with no active import or behavior claim"
  ],
  "releaseTrigger": "backend_api",
  "rollback": [
    "code_rollback"
  ],
  "decisionLog": [
    {
      "date": "2026-07-11",
      "decision": "Use five Phase 4 Slices: pure contracts, immutable PostgreSQL registry and legacy import, shadow readers, atomic manifest cutover, then scheduled candidate refresh."
    },
    {
      "date": "2026-07-11",
      "decision": "Mutable sync tables remain staging; public readers will use immutable release-scoped rows after cutover."
    },
    {
      "date": "2026-07-11",
      "decision": "The first observed Community Release is legacy-import-r0 but every winner must re-pass the current Resolver against its exact Gear Release."
    },
    {
      "date": "2026-07-11",
      "decision": "Promotion and rollback move one manifest pointer; sealed release content is never edited."
    }
  ]
}
